[
  {"schemaVersion":"lucida-style-variant/v1","variantId":"claim-proof","packageId":"claim-evidence","label":"Claim proof","description":"A dominant claim panel followed by a source-labelled ledger that makes the proof chain inspectable.","intentTags":["claim-validation","explain"],"beatRoles":["explain"],"contentDensity":"balanced","aspectRatios":["9:16"],"layoutTraits":["claim-ledger","dominant-claim-panel"],"typographyTraits":["high-contrast-claim","compact-source-labels"],"paletteTraits":["teal-context","green-support"],"motionTraits":["entrance-only","reduced-motion-compatible"],"componentTraits":["claim-panel","evidence-row","verdict-ladder"],"contentCapacity":{"maxItems":3,"maxPanels":2},"positiveUseCases":["bounded claim with supporting evidence"],"antiPatterns":["unqualified universal conclusion"],"sourceEvidenceIds":["w8-technical-primer-foundations"],"classificationReasons":["Local fixture-bound draft variant."],"classifierVersion":"draft-0.1.0","reviewStatus":"proposed"},
  {"schemaVersion":"lucida-style-variant/v1","variantId":"pro-con","packageId":"claim-evidence","label":"Pro and con","description":"Supporting and weakening observations occupy equal fixed columns before a mixed verdict is assigned.","intentTags":["claim-validation","compare"],"beatRoles":["compare"],"contentDensity":"balanced","aspectRatios":["9:16"],"layoutTraits":["balanced-comparison","equal-evidence-columns"],"typographyTraits":["direction-labels","compact-source-labels"],"paletteTraits":["green-support","red-weakening"],"motionTraits":["entrance-only","reduced-motion-compatible"],"componentTraits":["evidence-row","verdict-ladder"],"contentCapacity":{"maxItems":4,"maxPanels":2},"positiveUseCases":["competing evidence review"],"antiPatterns":["one-sided evidence selection"],"sourceEvidenceIds":["w8-technical-primer-foundations"],"classificationReasons":["Local fixture-bound draft variant."],"classifierVersion":"draft-0.1.0","reviewStatus":"proposed"},
  {"schemaVersion":"lucida-style-variant/v1","variantId":"benchmark-audit","packageId":"claim-evidence","label":"Benchmark audit","description":"Observed and reference measures remain in fixed columns so a performance claim can be audited line by line.","intentTags":["claim-validation","compare"],"beatRoles":["compare"],"contentDensity":"dense","aspectRatios":["9:16"],"layoutTraits":["audit-table","fixed-measure-columns"],"typographyTraits":["compact-table-labels","monospace-values"],"paletteTraits":["amber-uncertainty","green-support","red-weakening"],"motionTraits":["static-review","reduced-motion-compatible"],"componentTraits":["claim-panel","evidence-row","verdict-ladder"],"contentCapacity":{"maxMetrics":4,"maxPanels":2},"positiveUseCases":["performance claim audit"],"antiPatterns":["metric without a reference threshold"],"sourceEvidenceIds":["w8-dashboard-primer-react"],"classificationReasons":["Local fixture-bound draft variant."],"classifierVersion":"draft-0.1.0","reviewStatus":"proposed"},
  {"schemaVersion":"lucida-style-variant/v1","variantId":"myth-reality","packageId":"claim-evidence","label":"Myth and reality","description":"A rejected overbroad statement is explicitly replaced by a narrower conclusion that evidence can support.","intentTags":["claim-validation","explain"],"beatRoles":["correct"],"contentDensity":"balanced","aspectRatios":["9:16"],"layoutTraits":["correction-stack","statement-replacement"],"typographyTraits":["high-contrast-correction","compact-source-labels"],"paletteTraits":["red-rejected-claim","green-supported-correction"],"motionTraits":["entrance-only","reduced-motion-compatible"],"componentTraits":["claim-panel","evidence-row","verdict-ladder"],"contentCapacity":{"maxItems":3,"maxPanels":2},"positiveUseCases":["misconception correction"],"antiPatterns":["false binary without scope"],"sourceEvidenceIds":["w8-minimal-nng-hierarchy"],"classificationReasons":["Local fixture-bound draft variant."],"classifierVersion":"draft-0.1.0","reviewStatus":"proposed"},
  {"schemaVersion":"lucida-style-variant/v1","variantId":"source-triangulation","packageId":"claim-evidence","label":"Source triangulation","description":"Three evidence sources form a visible comparison grid before a deliberately provisional conclusion is stated.","intentTags":["claim-validation","compare"],"beatRoles":["synthesize"],"contentDensity":"balanced","aspectRatios":["9:16"],"layoutTraits":["source-grid","provisional-verdict"],"typographyTraits":["source-first-labels","bounded-verdict-copy"],"paletteTraits":["teal-context","green-support","amber-uncertainty"],"motionTraits":["entrance-only","reduced-motion-compatible"],"componentTraits":["evidence-row","verdict-ladder"],"contentCapacity":{"maxItems":3,"maxPanels":3},"positiveUseCases":["independent source comparison"],"antiPatterns":["treating agreement as approval"],"sourceEvidenceIds":["w8-dashboard-primer-react"],"classificationReasons":["Local fixture-bound draft variant."],"classifierVersion":"draft-0.1.0","reviewStatus":"proposed"}
]
